{
  "name": "inverted_external_token",

  "externals": [
    {"type": "SYMBOL", "name": "line_break"}
  ],

  "extras": [
    {"type": "PATTERN", "value": "\\s"}
  ],

  "rules": {
    "program": {
      "type": "REPEAT",
      "content": {
        "type": "SYMBOL",
        "name": "statement"
      }
    },

    "statement": {
      "type": "SEQ",
      "members": [
        {"type": "SYMBOL", "name": "_expression"},
        {"type": "SYMBOL", "name": "line_break"}
      ]
    },

    "_expression": {
      "type": "CHOICE",
      "members": [
        {"type": "SYMBOL", "name": "identifier"},
        {"type": "SYMBOL", "name": "member_expression"}
      ]
    },

    "member_expression": {
      "type": "PREC_LEFT",
      "value": 0,
      "content": {
        "type": "SEQ",
        "members": [
          {"type": "SYMBOL", "name": "_expression"},
          {"type": "STRING", "value": "."},
          {"type": "SYMBOL", "name": "identifier"}
        ]
      }
    },

    "identifier": {
      "type": "PATTERN",
      "value": "[a-z]+"
    }
  }
}
